{
  "from": "integration-architect",
  "to": "tech-lead",
  "artifact": "docs/buckets/sap-s4-interface-register/integration-spec.md",
  "approval_status": "approved",
  "gate_conditions": [
    "archimate_sync_mechanism_specified",
    "relationship_types_confirmed_against_metamodel"
  ],
  "unmet_conditions": [],
  "timestamp": "2026-09-15T00:00:00Z"
}
